{
  "$id": "urn:stock-research-llm-orchestrator:detailed-analysis.human-decision:v1",
  "$schema": "https://json-schema.org/draft/2020-12/schema",
  "additionalProperties": false,
  "description": "Immutable human workflow decision, never an investment recommendation.",
  "properties": {
    "allowed_options": {
      "items": {
        "minLength": 1,
        "type": "string"
      },
      "minItems": 2,
      "title": "Allowed Options",
      "type": "array"
    },
    "artifact_id": {
      "pattern": "^[A-Za-z0-9][A-Za-z0-9._:-]{0,127}$",
      "title": "Artifact Id",
      "type": "string"
    },
    "decided_at": {
      "pattern": "^\\d{4}-\\d{2}-\\d{2}T\\d{2}:\\d{2}:\\d{2}(?:\\.\\d+)?(?:Z|[+-]\\d{2}:\\d{2})$",
      "title": "Decided At",
      "type": "string"
    },
    "decider": {
      "minLength": 1,
      "title": "Decider",
      "type": "string"
    },
    "human_decision_id": {
      "pattern": "^[A-Za-z0-9][A-Za-z0-9._:-]{0,127}$",
      "title": "Human Decision Id",
      "type": "string"
    },
    "reason": {
      "minLength": 1,
      "title": "Reason",
      "type": "string"
    },
    "replaces_human_decision_id": {
      "anyOf": [
        {
          "pattern": "^[A-Za-z0-9][A-Za-z0-9._:-]{0,127}$",
          "type": "string"
        },
        {
          "type": "null"
        }
      ],
      "title": "Replaces Human Decision Id"
    },
    "schema_id": {
      "const": "detailed-analysis.human-decision",
      "title": "Schema Id",
      "type": "string"
    },
    "schema_version": {
      "const": 1,
      "title": "Schema Version",
      "type": "integer"
    },
    "selected_option": {
      "minLength": 1,
      "title": "Selected Option",
      "type": "string"
    },
    "target_dispute_id": {
      "anyOf": [
        {
          "pattern": "^[A-Za-z0-9][A-Za-z0-9._:-]{0,127}$",
          "type": "string"
        },
        {
          "type": "null"
        }
      ],
      "title": "Target Dispute Id"
    },
    "target_finding_id": {
      "anyOf": [
        {
          "pattern": "^[A-Za-z0-9][A-Za-z0-9._:-]{0,127}$",
          "type": "string"
        },
        {
          "type": "null"
        }
      ],
      "title": "Target Finding Id"
    },
    "task_id": {
      "pattern": "^[A-Za-z0-9][A-Za-z0-9._:-]{0,127}$",
      "title": "Task Id",
      "type": "string"
    },
    "workflow_decision_only": {
      "const": true,
      "title": "Workflow Decision Only",
      "type": "boolean"
    }
  },
  "required": [
    "schema_id",
    "schema_version",
    "task_id",
    "artifact_id",
    "human_decision_id",
    "target_dispute_id",
    "target_finding_id",
    "allowed_options",
    "selected_option",
    "decider",
    "reason",
    "decided_at",
    "replaces_human_decision_id",
    "workflow_decision_only"
  ],
  "title": "HumanDecisionV1",
  "type": "object"
}
